id,title,year,episode,song,artists
330623,7 Secrets with Miranda Cosgrove,2010.0,,Kissin U,lukasz gottwald+hkt+claude kelly+miranda cosgrove
449090,Gargandi snilld,2005.0,,All is Full of Love,björk+the icelandic string octet+matmos+zeena parkins
300077,Top of the Pops,1964.0,(1978-11-16),Do Ya Think Im Sexy?,rod stewart+carmine appice+duane hitchings
466658,Heartbreak Ridge,1986.0,,How Much I Care,clint eastwood+sammy cahn+jill hollier
408714,Dean Martin: The One and Only,2004.0,,Pretty Baby,egbert van alstyne+tony jackson+dean martin
577002,Pineapple Express,2008.0,,The Fixer,clem clempson+steve marriott+greg ridley+jerry shirley+humble pie
196595,Rock Concert,1973.0,(#1.3),Life,sly stone+sly+the family stone
275456,The Tonight Show Starring Johnny Carson,1962.0,(1974-06-21),Johnnys Theme,paul anka
326254,...Yahaan,2005.0,,Naam Adaa Likhna,gulzar+shantanu moitra+shaan+shreya ghoshal
547522,Mughal-E-Azam,1960.0,,Yeh Dil Ki Lagi,lata mangeshkar+chorus+naushad
138584,Life on Mars,2008.0,Things to Do in New York When You Think Youre Dead (#1.5),Black and White,three dog night
316927,Weekly Idol,2011.0,(#1.215),Black Swan,ricky+rainbow
450642,Get Hard,2015.0,,Oh S**t,tré hardson+fatlip+imani wilcox+j. swift+the pharcyde
230771,Syksyn sävel,1968.0,Syksyn sävel 1974 (#7.1),Avaa sydämesi mulle,matti siitonen
294922,Tiny Toon Adventures,1990.0,Inside Plucky Duck (#1.39),The Gold Diggers Song (Were in the Money),harry warren
171070,On nest pas couché,2006.0,(2008-10-18),In the Shadows,lauri ylönen+eero heinonen+pauli rantasalmi+aki hakala  )+the rasmus
648124,The Beat Generation: An American Dream,1987.0,,Home on the Range,the david amram quartet+friends
633214,Subject 0: Shattered Memories,2015.0,,Escape from the Temple,per kiilstofte
98518,Glee,2009.0,Furt (#2.8),Marry You,ari levine+bruno mars+philip lawrence+cory monteith+lea michele+dianna agron+chord overstreet
272241,The Tennessee Ernie Ford Show,1956.0,Spike Jones and His City Slickers (#1.6),Just a Closer Walk with Thee,tennessee ernie ford
690369,The Waterboy,1998.0,,Feed It,the candyskins
451667,Gibby,2016.0,,Itasca,paul spring
109830,Hillbilly Blood: A Hardscrabble Life (3-D),2011.0,Prospecting: The Hillbilly Savings Account (#1.5),Locked In,pedro rousseau+fresh body shop
462059,Hair-Raising Hare,1946.0,,Headin for My Beddin,bugs after re-disposing of the monster
560358,Notorious Big Sin City,1970.0,,Dont Wiggle the Toes,nat combo+e. tobalina+the solid mists
349391,Andrew Ford Medina: Wag kang gamol!,1991.0,,Kapag Tumibok ang Puso,donna cruz
363639,Begierde - Mord im Zeichen des Zen,2015.0,,Sip Of Vine,barclay james harvest
195816,Ripping Yarns,1976.0,Escape from Stalag Luft 112 B (#1.3),Sentry,jack trombey
277112,The Tonight Show with Jay Leno,1992.0,(#19.103),Mr. Jones,adam duritz+david bryson+the tonight show band
137549,Lesbian Sex and Sexuality,2007.0,Fulfilling Fantasy (#1.4),8/29,
386864,Cats Dont Dance,1997.0,,Tonight Im Going Out with You,bill elliott+his orchestra
111597,Hollywood Heights,2012.0,A Winner Is Chosen (#1.21),I Adore Paris,fawn
194870,Renovation Realities,2007.0,The McFarland Job (#4.4),The Roboboogie,kenneth james gibson
276017,The Tonight Show Starring Johnny Carson,1962.0,(1980-05-19),Johnnys Theme,paul anka
395468,College Road Trip,2008.0,,Sacrifice,gary kuo
344637,Almost Famous,2000.0,,Feel Flows,john rieley+carl wilson+the beach boys
355741,Aventuras de las hermanas X,1963.0,,Caballo Patas Blancas,
465255,Hating Alison Ashley,2005.0,,Dont Tell Me,gabriella cilmi
424320,Eagles: Hell Freezes Over,1994.0,,New York Minute,don henley+danny kortchmar+jai winding
718740,We Need to Talk About Kevin,2011.0,,WWOOOOO,rory stewart kinnear
294920,Tiny Toon Adventures,1990.0,How Sweetie It Is (#1.60),America the Beautiful,samuel a. ward
611453,Sharp,2013.0,,Surfs Up,cooper bombadil
311230,Velvet,2013.0,Cuenta atrás (#1.15),Wedding Organiser,herrick wilstrom
603812,Sara Akash,1969.0,,Soormadani Banne Teri Akhiya,salil choudhury
551223,Más bonita que ninguna,1965.0,,Sombrero viejecito,augusto algueró+antonio guijarro+rocío dúrcal
420980,Dr. Phibes Rises Again,1972.0,,Ach Du Lieber Augustin,
46861,Classic Ghost Stories,1986.0,Oh  Whistle  and Ill Come to You  My Lad (#1.4),Dark Passage,dennis farnon
262924,The Real World,1992.0,Danas  Derriers and Drama (#26.2),Real World San Diego Theme,shaun profeta
556084,Nickelodeon Kids Choice Awards 2012,2012.0,,Grenade,
323925,Zettai shônen,2005.0,Tsubasa no haeta sakana (#1.19),Hikari no Shiruetto,coorie
108016,Hell on Wheels,2011.0,Pride  Pomp and Circumstance (#1.6),Believe Me  If All Those Endearing Young Charms,lucy wainwright roche
235181,The 4400,2004.0,Daddys Little Girl (#4.9),Since I Dont Have You,joseph rock+james beaumont+the skyliners
70942,Dinosaur Train,2009.0,Dinosaur Camouflage/Family Scavenger Hunt (#1.21),Dinosaur Train Theme,craig bartlett+jim lang
426059,Ek Duuje Ke Liye,1981.0,,Hum tum dono jab mil jayenge  ek naya itihaas banayege,lata mangeshkar+balasubramaniam s.p.+laxmikant shantaram kudalkar+pyarelal ramprasad sharma
694343,Thirty Seconds Over Tokyo,1944.0,,Chattanooga Choo Choo,harry warren
40412,Californication,2007.0,Exile on Main St. (#4.1),Check My Brain,jerry cantrell+alice in chains
145845,MTV Webbed,2013.0,Showoffs Get Shutdown! (#1.3),O Heeriye,ayushmann khurrana+rochak kohli
8434,Airs de France,1956.0,Là-haut (#2.4),Duo Evariste-Frisotin,maurice yvain+marcel amont+lucien baroux
426737,El ciclón,1959.0,,Llegando a ti,josé alfredo jiménez+flor silvestre
464712,Harold & Kumar Go to White Castle,2004.0,,Camel Toe,m. goias+k. grady+fannypack
317156,Welcome to the 80s,2009.0,Postpunk und Neue Deutsche Welle (#1.1),Damaged Goods,dave allen+hugo burnham+andy gill+jon king+gang of four
568563,Out Cold,2001.0,,Green Light Girl (Rock Remix),doyle bramhall ii+susannah melvoin+doyle bramhall
257280,The Naked Brothers Band,2007.0,Puberty (#1.6),If Thats Not Love,
178280,Parenthood,2010.0,The Ring (#5.8),Just Beneath the Surface (Reprise),taylor goldsmith+dawes
576198,Pi,1998.0,,Bucephalus Bouncing Ball,aphex twin
547529,Mughal-E-Azam,1960.0,,Mohe Panghat Pe,lata mangeshkar+chorus+naushad
731097,Yu-Gi-Oh! 3D: Bonds Beyond Time Abridged,2011.0,,Beelzeboss,jack black+kyle gass+liam lynch+tenacious d
40168,Caillou,1997.0,Caillous Winter Wonders (#8.3),Dreidel,
355210,Austin Powers in Goldmember,2002.0,,Alfie (Whats It All About  Austin?),burt bacharach+hal david+susanna hoffs
237334,The Beatles Anthology,1995.0,,Across The Universe,john lennon+paul mccartney+the beatles
494555,Juan Pardo año nuevo,1995.0,,Año nuevo,juan pardo
652278,The Canyon,2009.0,,Back Of My Mind,jim reilley+james scott reilley
576785,Pikkusisar,1999.0,,Pikkusisar Theme,jukka siikavire
568471,Our Story Our Voice,2007.0,,Into the Beyond,tunde jegede+cleveland watkiss+byron wallen
249668,The Jimmy Dean Show,1963.0,(1963-11-21),Among My Souvnieurs (uncredited),homer+jethro
123524,James at 15,1977.0,Star-Crossed Lovers (#1.11),Any Way That You Want Me,randy richards
614499,Sick-o-pathics,1996.0,,Fatal Frames (Main titles),al festa
119311,Iltatähti,1973.0,(1974-12-27),Hear Me Calling,alvin lee+hurriganes
728403,Yakeen,1969.0,,Baharon Ki Baraat Aa Gayee,shankarsingh raghuwanshi+jaikishan dayabhai panchal+mohammad rafi
727781,X-Men: Apocalypse,2016.0,,Glory Of The Trumpets,j. bronshire
669712,The Last of the Blonde Bombshells,2000.0,,Dont Sit Under the Apple Tree,sam h. stept+the blonde bombshells
7415,Absolutely Fabulous,1992.0,Birth (#2.6),Once Upon A Star,david farnon
601076,Ruth Orkin: Frames of Life,1996.0,,From Foreign Lands and People (Von fremden Ländern und Menschen  Op. 15  No. 1),robert schumann+donna lee weng
155027,Miss Fishers Murder Mysteries,2012.0,Ruddy Gore (#1.6),Makin Whoopie,silvio blonde+his invisible orchestra
688493,The Trust,2016.0,,Lucky Vegas Gamblin Man,travis jones/riley+rod rogers+the travis jay jones orchestra
556494,Night and Day,1946.0,,Rock-a-Bye Baby,effie i. canning
257234,The Naked Brothers Band,2007.0,Alexs Clothing Line (#1.5),If Thats Not Love,
549093,Muuttolinnun aika,1991.0,,Kanoottilaulu,sielun veljet+t.t. oksala
161661,My Dear Cat,2014.0,(#1.39),Slowly Closer,ryu won kwang+choi yoon young
102069,Great Performances,1971.0,Sondheim! The Birthday Concert,Partial Sweeny Todd,stephen sondheim
494312,Joy,2015.0,,River Road,pedrito martinez+the pedrito martinez group
726847,Woodfalls,2014.0,,Lets Get Funky (Ft. Omen),lyrical monsoon - gavin roberts+irrelevance+omen
579274,Pokazatelnyy protsess: Istoriya Pussy Riot,2013.0,,Putin Pissed Himself,pussy riot
212612,Simons Danseskole,2010.0,(#1.3),Crips,ratatat
132001,La Malquerida,2014.0,Acacia no logra alejarse de Esteban (#1.84),La Malquerida,pablo preciado+román torres cuevas+alejandro pérez gonzález+cristián castro+jesús navarro+melissa robles
311065,Vanity High,2006.0,The Super Fan (#1.23),Together (Acoustic),joshua lee+esther lee
680601,The Range Busters,1940.0,,Get Along Little Cowboy,johnny lange+lew porter+john dusty king
349167,And So Life Goes On,2007.0,,Comin Round,josh rifkin
61841,De Mike Burstyn show,1978.0,(#3.3),Its Showtime,katja ebstein+mike burstyn
479044,I Hope They Serve Beer in Hell,2009.0,,Thunder and Blazes: Entry March of the Gladiators,julius fucik
478824,I Dreamed of Africa,2000.0,,Chatter Box,jack trombey
387559,Cenatrofiasse,2015.0,,Doll Dancing,puddle of infinity
42499,Carrossel,2012.0,Capítulo 26 (#1.26),Brincadeira de Criança,crianças
723366,Who Done It?,1956.0,,Jingle Bells,james pierpont
576545,Piedras verdes,2001.0,,Me cago en el amor,tonino carotone
15680,Archer,2009.0,Placebo Effect (#2.9),The Killer,mel young
414300,Die Operngala der Stars,2007.0,,E lui! desso! ... Dio  che nellalma infondere,giuseppe verdi+ramón vargas+ludovic tézier  with swr sinfonieorchester baden-baden und freiburg
518864,Light It Up,1999.0,,If Only in Heavens Eyes,kenneth babyface edmonds+*nsync
500141,Kickstand,2012.0,,The Day We Started,afternoon naps
707966,Una lección de amor,1956.0,,No Me Olvides Nunca,federico baena+carmela rey
665553,The Hot Chick,2002.0,,Bounce,mike hampton+ramon richardson+dj magic mike
633766,Suhaag Raat,1968.0,,Ganga O Ganga Maiya  O Ganga Maiya Mein Jab Tak Yeh Pani Rahe,kalyanji veerji shah+anandji veerji shah
729297,Yi shou yaogun shang yueqiu,2013.0,,I Love You,spark chen+sleepy dads
98582,Glee,2009.0,Heart (#3.13),Chapel of Love,jeff barry+ellie greenwich+phil spector+brian stokes mitchell+jeff goldblum
112420,Home Movies,1999.0,Focus Grill (#4.13),Sunset Theme,brendon small
14821,Animaniacs,1993.0,Were No Pigeons/Whistle Stop Mindy/Katie Ka-Boom: The Broken Date (#2.3),Chicken Reel,
664804,The Hidden,1987.0,,Black Girl White Girl,stiv bators+brian james+the lords of the new church
225043,Star Trek: Voyager,1995.0,Tinker Tenor Doctor Spy (#6.4),Star Trek: Voyager - Main Title,jerry goldsmith+jay chattaway
623401,Sonshine,2016.0,,Love Addict,nathan currin+jacob olds+solomon olds+family force 5
529334,Madeline and the Gypsies,1991.0,,Slovakia,jeffrey zahn
587899,Radio City Christmas Spectacular,2007.0,,Jolly Old St. Nicholas,
718598,We Bought a Zoo,2011.0,,I Think Its Going to Rain Today,randy newman+arrangement with warner music group film+tv licensing
434759,Extinction,2018.0,,Fall,type 14
567717,Oru Kal Oru Kannadi,2012.0,,Kaadhal Oru,na. muthukumar+aalap raju+hemchandra+sunitha sarathy
420774,Downstream,2010.0,,Tale of Ol Silverboy,blackbird suite
619433,Smalltown,2016.0,,Thinking About You,big atomic
422922,Dudes,1987.0,,Show No Mercy,w.a.s.p.
548779,Musical Merry-Go-Round #4,1948.0,,Leap Frog,joe garland+leo corday+les brown+his orchestra
348779,Anak,2000.0,,Bato sa Buhangin,ernani cuenco+vilma santos+joel torre+hazel ann mendoza
275562,The Tonight Show Starring Johnny Carson,1962.0,(1975-07-30),Johnnys Theme,paul anka
147902,Make Room for Daddy,1953.0,Venetian Melody (#10.27),Danny Boy,frederick edward weatherly+tony brandt
80871,El puntero,2011.0,(#1.3),Ciudad de pobres corazones,fito páez
583472,Private School,1983.0,,The American Girl,rick springfield
281318,The Vampire Diaries,2009.0,Ill Remember (#6.1),Young Chasers,circa waves
287588,The X Factor,2004.0,Live Final (#2.29),Happy Xmas (War Is Over),john lennon+yoko ono+journey south
109395,Hewys Animated Movie Reviews,2008.0,Gnomeo and Juliet (#4.1),Hello Hello,elton john+lady gaga
370716,Blondie on a Budget,1940.0,,Goodbye,francesco paolo tosti
725038,Willy McBean and His Magic Machine,1965.0,,Knights of the Round Table,edward thomas+gene forrell+james polack
252058,The Life and Legend of Wyatt Earp,1955.0,The Buntline Special (#1.16),The Legend of Wyatt Earp,harry warren+the ken darby singers
99244,Glee,2009.0,Yes/No (#3.10),We Found Love,calvin harris+lea michele+naya rivera+the glee cast
580050,Popcorn,2007.0,,Time To Get It On,mista groove+joneice jamieson
552761,Naomi & Wynonna: Love Can Build a Bridge,1995.0,,MAMA HES CRAZY,kenny odell+the judds
544838,Moonlight on the Prairie,1935.0,,Moonlight on the Prairie,tim spencer+bob nolan+dick foran  at the end
198834,Rude Tube,2008.0,Epic Fails (#3.1),Here We Go,john philip sousa
120063,Independent Lens,1999.0,Have You Heard from Johannesburg: The Bottom Line (#13.11),Control,the beatnigs
723881,Why Do Fools Fall in Love,1998.0,,Long Lonely Nights,lee andrews+douglas henderson+mimi unman+bernie davis+clyde mcphatter+arrangement with warner special products
269905,The Sopranos,1999.0,Join the Club (#6.2),Just a Little Bit,rosco gordon+mike finnigan
111242,Hit Wo Nerae! Smash Hit!,2004.0,Hitori... (#1.7),Hitto wo nerae!,toshihiko sahashi
732520,Zombie ja Kummitusjuna,1991.0,,KARJAA KARJALAAN,matti pellonpää
83535,Entourage,2004.0,Sniff Sniff Gang Bang (#7.8),First Call,eric v. hachikian
440857,Flash Gordon,1980.0,,Vultans Theme (Attack Of The Hawk Men),freddie mercury+queen
295176,Tiny Toon Adventures,1990.0,Rainy Daze (#1.29),Pop Goes the Weasel,
677091,The Other Sister,1999.0,,Im Free,mick jagger+keith richards+soup dragons
639720,Tanner Hall,2009.0,,A Few Minutes of Silence,paul westerberg+arrangement with warner music group film+tv licensing
246721,The Good Wife,2009.0,Minds Eye (#6.14),Sweet Jane,liz phair
104334,Guapas,2014.0,Charlas de hombres (#1.26),Un ange frappe à ma porte,natasha st-pier
267310,The Simpsons,1989.0,Bart Stops to Smell the Roosevelts (#23.2),The Gold Diggers Song (Were In the Money),harry warren
453978,God Rot Tunbridge Wells!,1985.0,,Let envy then conceal her head,george frideric handel+john shirley-quirk
379974,Bully,2001.0,,Last Call,ol dirty bastard+master fool
492409,Jingle Cats Christmas,2008.0,,Oh Come All Ye Faithful,the jingle cats
574044,Pendulum Swings,2011.0,,Flashback,jeff hartman+immanuel bible church orchestra
728339,Yaan,2014.0,,Nenje Nenje,kabilan+unnikrishnan+chinmayee sripada
426573,El año de la garrapata,2004.0,,THE ISRAELITES,
284812,The Wind in the Willows,1984.0,Burglary at Toad Hall (#1.11),The Wind in the Willows song,ralph mctell+keith hopwood+malcolm rowe
594106,Rick Wakeman in Concert: Journey to the Centre of the Earth,1975.0,,The Forest,rick wakeman
650786,The Boy with Green Hair,1948.0,,How Many Miles to Dublin Town?,pat obrien+boys
536073,McLibel,2005.0,,Liberation,luminous frenzy
695294,This Wretched Life,2010.0,,Bonus Track,index case
212346,Sikeurit Gadeun,2010.0,(#1.14),I Cant,mi
347615,Amhi Doghe Raja Rani,1986.0,,Mi Premnagarcha Raja,suresh wadkar+asha bhosle+vijay patil
334909,A Night at the Roxbury,1998.0,,Cocktails For Two,arthur johnston+sam coslow
307330,Turn Back Time: The Family,2012.0,The 1970s (#1.5),Get It On,marc bolan+t. rex
63669,Degrassi: The Next Generation,2001.0,Everything She Wants (#7.21),Jungle Dance,cosima grunsky
90253,Follow the Sun,1961.0,Night Song (#1.11),Let There Be Love,lionel rand+julie london+performed in a rehearsal with a manila jazz combo
27750,Belmonte,2013.0,(#1.251),Mente-me Com os Olhos,carolina deslandes
234040,Teen Wolf,2011.0,Wolf Moon (#1.1),My Body,young the giant
577664,Pitch Perfect 2,2015.0,,Bang Bang,savan kotecha+rickard göransson+max martin+nicki minaj+jessie j+ariana grande
579914,Pootie Tang,2001.0,,TIPPY TAI ON MY CAPPATOWN,louis c.k.+prince paul+qiana drew+tara jeffers+lorria richards+lance crouther
301377,Top of the Pops,1964.0,(1980-12-18),Whole Lotta Love,ccs+jimmy page+john bonham+robert plant+john paul jones
221274,Splash,1985.0,(1988-06-03),Hey Mr Heartache,kim wilde
366666,Bhalobasar Rong,2012.0,,Prem Roshiya,mila+saimon+biplob sarkar+shawkat ali emon
335380,A Queen Is Crowned,1953.0,,Hearts of Oak,william boyce
349412,Andrey Iskanovs Ingression,2010.0,,Hell.fm,manasyt
477249,Hullujussi: 30 vuotta Friduna Skikuna,2003.0,,Bingo Bango Bongo,viktor kalborok / hullujussi
198579,RuPauls Drag Race,2009.0,Lip Synch Extravaganza Eleganza (#5.2),Tranny Chaser,rupaul+lucian piane
201812,Saturday Night Live,1975.0,Drew Barrymore/Regina Spektor (#35.3),Eet,regina spektor
53720,Curb Your Enthusiasm,2000.0,Trick or Treat (#2.3),Night Fiesta,stelvio cipriani
132141,La Malquerida,2014.0,Héctor recomienda a Cristina  no dejar sola a Acacia (#1.57),La Malquerida,pablo preciado+román torres cuevas+alejandro pérez gonzález+cristián castro+jesús navarro+melissa robles
282200,The Voice Chile,2015.0,(#1.17),Cuando nadie me ve,luis pedraza
116807,Idol - Jakten på en superstjerne,2003.0,Topp 9 - Norsk på Norsk (#2.8),Ville fugla flyg,frode viken+rolf mokkelbost+trung tuan tong
67528,Deligianneion Parthenagogeion,2007.0,,Dyo hili katakokkina,vasilis papakonstadinou+zoi tiganouria
553725,Nearing Grace,2005.0,,Lets Go,ric ocasek+band of warhols
679195,The Preppie Murder,1989.0,,Wicked Game,chris isaak
494480,Joyful Partaking,2001.0,,Le Cathedral Engloutie,claude debussy+london philharmonic orchestra
452272,Girl Walks Into a Bar,2011.0,,Dignified Dignitary,robert schneider   / bill doss / john hill+the apples in stereo
166472,New York Undercover,1994.0,A Time to Kill (#2.14),Just A Man,david hidalgo+louis perez+los lobos
212431,Sikeurit Gadeun,2010.0,(#1.8),Reason,4men
245614,The Fresh Beat Band,2009.0,Royal Wedding (#3.18),Another Perfect Day,the fresh beat band
209032,Sharon  Lois & Brams Elephant Show,1984.0,Food Show (#1.5),Boom-Boom Aint It Great to be Crazy?,eric nagler
722187,When the Wind Blows,1930.0,,That Old Gang Of Mine,ray henderson
90586,Forever,2014.0,The Night in Question (#1.21),Ive Got Dreams To Remember,otis redding
549784,My Favorite Movie,2015.0,,Robot Dream,maiah wynne+troy william dunn
352972,Armed Servicers,1974.0,,Je taime... moi non plus,serge gainsbourg+jane birkin
637576,Sympathy for Delicious,2010.0,,09-15-00 Part 1,godspeed you! black emperor
156008,MisteRogers Neighborhood,1968.0,1446 (#8.56),Sometimes Isnt Always,tony bennett
440791,Flames: The Movie,1997.0,,Iniibig Kita,
516279,Les malheurs de Sophie,2016.0,, Sophie dans la mare,
653100,The Choice,2016.0,,Terrible Love (Alternative Version),matt berninger+aaron dessner+the national+arrangement with beggars group media limited
637422,Switchback,1997.0,,Titanic,keith gattis+kostas
206214,Seriesly,2015.0,Goldfinger (#1.3),From Russia with Love,leslie bricusse+anthony newley+ben mooney
580728,Porkys Revenge,1985.0,,High School Nights,john david+steve gould+dave edmunds
238349,The Big Bang Theory,2007.0,The Maternal Combustion (#8.23),Its the Hard Knock Life,charles strouse+simon helberg+kunal nayyar+kevin sussman
465959,Hes Just Not That Into You,2009.0,,Sweet Sixteen Bars,ray charles+michael pewny+torsten zwingenberger
69231,Deutschland sucht den Superstar,2002.0,Mottoshow #4 - Christmas Songs (#2.15),White Christmas,irving berlin+anke wagner
411112,Der Sieger,1932.0,,Lied im kleinen Hotel,werner r. heymann
558683,Nobody,2009.0,,Bring On The Clowns,daniel tashian+the silver seas  from the album starry gazey pie
564305,Olhar Estrangeiro,2006.0,,Desembestado,zé paulo becker
479279,I Love You Phillip Morris,2009.0,,Nobody Knows the Trouble Ive Seen,the golden gate quartette
423027,Duets,2000.0,,Free Bird,allen collins+ronnie van zant+arnold mcculler
75429,Drag Race: Untucked!,2010.0,RuPauls Big Opening: Part 2 (#6.2),Cover Girl (Put the Bass in Your Walk,rupaul+lucian piane
295308,Tiny Toon Adventures,1990.0,Test Stress (Never Too Late to Loon/Lil Sneezer/To Bleep or Not to Bleep) (#1.4),Brahms Lullaby,johannes brahms
297069,Todds Pop Song Reviews,2009.0,Top Ten Worst Hit Songs of 1976 (#2.7),BlahBlahBlah,kesha+levin+neon hitch+sean foreman+3oh!3
225332,Stargate SG-1,1997.0,New Order: Part 1 (#8.1),Main Title,joel goldsmith+david arnold
91814,Freaks and Geeks,1999.0,The Diary (#1.10),No Language in Our Lungs,andy partridge+xtc
363634,Begierde - Mord im Zeichen des Zen,2015.0,,More Hands,cliff martinez
597151,Rock for Afrika,1985.0,,Fed rock,shu-bi-dua
497429,Kangaroo Jack,2003.0,,Down Under,colin hay+ronald strykert+men at work
134862,Late Night with Jimmy Fallon,2009.0,(#3.59),Oh  Pretty Woman,roy orbison+bill dees+the roots
717247,Wanderlust,2006.0,,Born to Be Wild,mars bonfire+steppenwolf
716801,Walk the Light,2013.0,,Big Jumps,emiliana torrini+arrangement beggars group media limited
682744,The Saint of Fort Washington,1993.0,,SHAME,julia fordham
466986,Heaven Is for Real,2014.0,,We Will Rock You,brian may+joss glennie-smith+seth glennie-smith
479166,I Like Mountain Music,1933.0,,Sweepin the Clouds Away,sam coslow
444599,Fraternity Vacation,1985.0,,COAST TO COAST,sal baglio+the stompers
413270,Di yi ci,2012.0,,Yuzhong zhi wu,hutian taihong
333899,A Kylie Christmas: Live from the Royal Albert Hall,2015.0,,Santa Claus is Coming to Town,j. fred coots+haven gillespie+kylie minogue
494294,Jowar Bhata,1969.0,,Mon Jodi Bhenge Jay Jaak  Jaak Kisu Bolbona,sabina yasmin+khan ataur rahman
376919,Brighton Beach Memoirs,1986.0,,Infatuation,walter g. samuels+leonard whitcup+performed george hall+his orchestra
398812,Coses que passen...,2006.0,,Naita,ramón giménez+juan luis leprevost artiach+macaco+marina la canillas+ojos de brujo
599028,Rose of Washington Square,1939.0,,Pretty Baby,egbert van alstyne+tony jackson+al jolson
726467,Woman on Top,2000.0,,Onde Anda Você,vinicius de moraes+hermano silva+toquinho
414161,Die Jungfrauen Maschine,1988.0,,Paradise Drive,blazing redheads
347085,American Piety,2008.0,,American Piety (closing theme),steven karageanes
290070,The Young and the Restless,1973.0,(#1.6552),Nadias Theme,barry de vorzon+perry botkin jr.
390988,Chooriyan,1963.0,,Wey Gall Sunn Hania  Wey Dil Diya Jaania,noor jehan+tufail farooqi
556130,Nico Icon,1995.0,,Reich der Träume,lutz ulbrich+nico
344079,All in Time,2015.0,,Hindsightseeing,bret alexander+the badlees
398351,Cool as Ice,1991.0,,Its My Heart Thats Breaking,oliver lieber+denise lopez
348024,Amulet,2009.0,,Bagtat Kumapit,jeffrey villegas
395331,Collapse,2009.0,,Money,present music
219702,Sons of Anarchy,2008.0,NS (#3.13),Dont Owe You a Thang,gary clark jr.
241704,The Danny Kaye Show,1963.0,(#4.4),Charade,buddy greco
67142,Deixa-me Amar,2007.0,(#1.65),Tu pertences a mim,os azeitonas
35949,Britains Got More Talent,2007.0,(#9.3),Crossroads,blazin squad
631281,Store planer!,2005.0,,If you Wany Blood,lesbian lipstick+tom pond
466,11.22.63,2016.0,Other Voices  Other Rooms (#1.3),Only in My Dreams,frank fafara
714854,Vivir para amar,1980.0,,Aprendiendo a vivir,rigo tovar
200533,Sam & Cat,2013.0,#BlooperEpisode (#1.27),I Can Just Imagine,michèle vice-maslin+magnes funemyr+zack sofine
650640,The Bounty Hunter,2010.0,,On My Mind,max fox+luke skeels+the boneless ones
168074,No me la puc treure del cap,2010.0,El meu avi (#1.13),El meu avi,josé luis ortega monasterio+xavi lozano
637380,Swiss Miss,1938.0,,The Cricket Song,phil charig+walter woolf king+eric blore+grete natzler+the hotel staff
390219,Chickenfoot: Get Your Buzz on Live,2009.0,,Get It Up,chickenfoot
280252,The Tribe,1999.0,(#4.49),The Dream Must Stay Alive,simon may+simon lockyer+ben robbins+meryl cassie
471673,Hold the Wire,1936.0,,Im Popeye the Sailor Man,samuel lerner
532872,Manila Kingpin: The Asiong Salonga Story,2011.0,,Hari ng Tondo,gloc-9+denise barbacena
359981,Barbra: The Concert,1995.0,,You Dont Bring Me Flowers,neil diamond+alan bergman+marilyn bergman+barbra streisand
522086,London to Brighton,2006.0,,Room Without Lights,roger eno+lol hammond
507918,La guerre est déclarée,2011.0,,Theme from _La cosa buffa (1972)_ (qv)  directed by Aldo Lado (qv),ennio morricone
212229,Sid the Science Kid,2008.0,Sids Amazing Lungs (#1.38),Breathe In  Breathe Out,donna kimball
323334,Yugio deyueru monsutazu,2000.0,Face Off  Part 1 (#1.22),Energizing Shower,aki maeda
504181,Kudmai,1987.0,,Chal Baliye Nee Chal,jaspal singh+savita sethi+s. madan+music on super cassettes
513383,Le couteau dans la plaie,1962.0,,Le Couteau Dans La Plaie (Lisa Goes Crazy) (Finale),mikis theodorakis+his orchestra
3157,50 años de,2009.0,La primera vez (#2.5),Satanasa,pedro almodóvar+fabio mcnamara+bernardo bonezzi+carlos garcía berlanga+fabio mcnamara  (as almodóvar+mcnamara)
179464,Pastor Mike Online,2011.0,What Is the Underground Church? (#1.197),Do You Hear What I Hear?,gloria shayne+michael hoggard
245437,The Fresh Beat Band,2009.0,Bubble Blast (#1.19),Get Up And Go Go,scott kraft+nadine van der velde+the fresh beat band
612220,Sheitan,2006.0,,Comme Un Sampler,
394203,Cloverfield,2008.0,,Seventeen Years,evan peter mast+michael duane stroud+ratatat
502270,Kiss Me  Guido,1997.0,,I Am What I Am,jerry herman+gloria gaynor
496643,KOVAS Hollywood,2014.0,,Hollywood,kovas+arrangement with infinite rhythm
232420,Tatort,1970.0,Salü Palu (#1.201),Stop for a minute,michael cretu+klaus hirschburger+sandra
541449,Mine Games,2012.0,,Historys Door,gawenda/preiss/tweedie+husky
7886,After the Catch,2007.0,Looking Ahead (#6.6),Paving Eisenhower,leftover salmon
211117,Shindig!,1964.0,(#2.11),The Jolly Green Giant,lyn easton+the kingsmen
149353,Mary Tyler Moore,1970.0,And Now  Sitting in for Ted Baxter (#2.9),Love Is All Around,sonny curtis
267665,The Simpsons,1989.0,Gone Abie Gone (#24.4),Ride of the Valkyries,richard wagner
